Title,City,Price,Time
APPARTEMENT A LOUER A HAY EL MANEH RABAT 4 PIECES,Rabat / Yacoub El Mansour,5 000 DH,26 Oct 2022 11:08
APPARTEMENT 3P MEUBLE A PLACE PETRI RABAT,Rabat / Hassan,7 500 DH,25 Oct 2022 10:40
Un grande appartement en location à DIOUR JAMAA,Rabat / Diour Jamaa,5 500 DH,25 Oct 2022 10:40
PETIT STUDIO MEUBLÉE A LOUER,Rabat / Agdal,4 200 DH,25 Oct 2022 10:40
Appartement meublé à Prestigia ensoleillé,Rabat,15 500 DH,25 Oct 2022 10:39
APPARTEMENT VIDE A MABELLA,Rabat / Mabella,6 500 DH,24 Oct 2022 15:24
Appartement vide à louer fait 120m²,Rabat,6 500 DH,24 Oct 2022 15:24
Appartement meublée en location,Rabat / Agdal,7 500 DH,24 Oct 2022 15:05
Appartement standing prrstigia5800dh,Rabat / Agdal,5 800 DH,23 Oct 2022 16:21
STUDIO MEUBLÉE A 4500/MOIS,Rabat / Agdal,4 500 DH,22 Oct 2022 16:52
Appartementa agdal rabat,Rabat / Agdal,7 890 DH,22 Oct 2022 00:10
Duplex meublé à Hassan Rabat a louer.,Rabat / Hassan,17 000 DH,21 Oct 2022 19:28
Appartement neuf à vendre à Sekhirate,Rabat,750 000 DH,21 Oct 2022 19:28
Location d'un appartement  vide,Rabat,8 000 DH,21 Oct 2022 19:27
Appartements diourjama3300dha,Rabat,3 300 DH,21 Oct 2022 19:27
2nd ces diourjamaa,Rabat / Agdal,3 300 DH,21 Oct 2022 19:26
APPARTEMENT A LOUER (KBIBAT),Rabat,3 800 DH,20 Oct 2022 20:51
A AGDAL APPARTEMENT MEUBLE,Rabat / Agdal,5 500 DH,20 Oct 2022 20:50
APPARTEMENT à location par mois,Rabat / Agdal,8 500 DH,20 Oct 2022 20:50
COQUET APPARTEMENT 2 PIÈCES MEUBLÉ,Rabat / Hassan,5 500 DH,20 Oct 2022 20:50
Location ht agdal pres de descartes,Rabat / Agdal,10 500 DH,20 Oct 2022 13:11
APPARTEMENT MEUBLE PROCHE LA GARE RABAT VILLE,Rabat / Hassan,7 500 DH,19 Oct 2022 11:06
APPARTEMENT DE 6 PIÈCES à AGDAL,Rabat / Agdal,17 500 DH,19 Oct 2022 11:06
Appartement meublée en location à Agdal,Rabat / Agdal,8 500 DH,19 Oct 2022 11:03
BEL APPARTEMENT FAIT 120M² A LOUER,Rabat / Agdal,7 800 DH,19 Oct 2022 11:03
APPARTEMENT A LA HAUT AGDAL A LOUER,Rabat / Agdal,12 500 DH,18 Oct 2022 10:54
Appartement meublé en location à AGDAL,Rabat / Agdal,8 500 DH,18 Oct 2022 10:54
HAUT AGDAL APPARTEMENT USAGE BUREAU,Rabat / Agdal,17 000 DH,17 Oct 2022 17:22
Appt exceptionnel,Rabat,8 000 DH,16 Oct 2022 21:37
Appartement 3pieces5200dh,Rabat / Agdal,5 200 DH,14 Oct 2022 12:56
Apparmement moukawana3600dhh,Rabat / Agdal,3 600 DH,14 Oct 2022 12:55
Appartement a louer,Rabat / Agdal,14 500 DH,14 Oct 2022 07:29
Apparemment entièrement rénové,Rabat / Hay Al Massira,5 000 DH,13 Oct 2022 14:50
Duplex meublé  face à Paul AGDAL,Rabat / Agdal,15 000 DH,12 Oct 2022 21:30
Appartement à Agdal en location,Rabat / Agdal,8 500 DH,12 Oct 2022 17:38
APPATEMENT A LOUER,Rabat / Agdal,111 111 DH,12 Oct 2022 17:38
APPARTEMENT BIEN MEUBLEE SUR AGDAL ...,Rabat,9 000 DH,12 Oct 2022 13:19
Appartement meuble a hassan,Rabat / Hassan,7 500 DH,12 Oct 2022 13:19
JOLI STUDIO MEUBLE A LOUER,Rabat / Hassan,6 500 DH,12 Oct 2022 11:02
APPARTEMENT DE 2 PIÈCES A LOUER,Rabat / Agdal,7 500 DH,12 Oct 2022 11:02
Location d'un appartement  vide a  WIFAQ , TEMARA,Rabat / Agdal,5 500 DH,11 Oct 2022 17:25
Location appartement à Agdal,Rabat / Agdal,7 000 DH,11 Oct 2022 17:24
Appartement Haut Standing,Rabat,3 900 DH,11 Oct 2022 13:52
APPARTEMENT MEUBLÉE A RABAT,Rabat,7 800 DH,11 Oct 2022 13:52
APPARTEMENT VIDE A LOCATION,Rabat,6 500 DH,11 Oct 2022 13:49
Appartement 100m2, 3 etage âhassan rabat,Rabat / Hassan,6 000 DH,10 Oct 2022 17:35
Appartement usage bureau au center ville Rabat,Rabat,5 500 DH,10 Oct 2022 15:03
Appartement 80m² deuxième étage. (Hay WIFAK - TEME,Rabat,91 DH,10 Oct 2022 15:03
Appartement situé ocean,Rabat / Agdal,3 400 DH,09 Oct 2022 13:12
Appartement 3piece skbibat,Rabat / Agdal,3 800 DH,07 Oct 2022 11:56
Joli appartement meublé de 2 pièces à Hassan,Rabat / Hassan,5 500 DH,07 Oct 2022 11:55
Au Quartier Mabella appartement en location,Rabat / Mabella,4 500 DH,06 Oct 2022 17:39
Appartement 3 pieces a diour jamma,Rabat / Diour Jamaa,1 DH,06 Oct 2022 13:15
Appartement en location,Rabat / Hay Ryad,11 000 DH,06 Oct 2022 13:11
Appartement bien situé agdal125u,Rabat / Agdal,1 250 000 DH,05 Oct 2022 18:47
Location d’un Villa meublé  ensoleillé,Rabat / Agdal,35 000 DH,04 Oct 2022 16:00
Location d’un Villa  vide ensoleillé,Rabat / Agdal,32 000 DH,04 Oct 2022 16:00
Appt usage bureau au habitation,Rabat / Ocean,6 500 DH,04 Oct 2022 15:57
APPARTEMENT VIDE A LOUER,Rabat,8 000 DH,04 Oct 2022 15:56
PROCHE LYCEE DESCARTES APPARTEMENT 3 CH SALON,Rabat / Agdal,8 000 DH,04 Oct 2022 15:56
APPT Meublé équipé 100m à louer à Kebibat Rabat,Rabat / Hassan,8 000 DH,03 Oct 2022 16:34
Bel appartement à louer a DIOUR JAMAA,Rabat / Diour Jamaa,5 500 DH,03 Oct 2022 10:34
Bon Emplacement Agdal Rabat,Rabat / Agdal,8 000 DH,02 Oct 2022 22:57
Apt meublé hay Fath rabat,Rabat,4 800 DH,02 Oct 2022 16:20
Appartement meublé à louer Hassan, Rabat,Rabat / Hassan,6 000 DH,01 Oct 2022 22:31
Location un apt à l agdal,Rabat / Agdal,5 000 DH,30 Sep 2022 14:02
APPARTEMENT AVEC PLACE GARAGE HASSAN RABAT,Rabat / Hassan,6 500 DH,29 Sep 2022 18:39
Location d'un appartement à youssoufia ouest rabat,Rabat / Youssoufia,3 500 DH,29 Sep 2022 11:50
Joli appartement propre Hassan,Rabat / Hassan,6 500 DH,29 Sep 2022 00:23
Location d’un  Appartement vide A HAY RIAD,Rabat / Agdal,12 000 DH,28 Sep 2022 20:44
location d'un   appartement  vide a hay riad,Rabat / Agdal,12 000 DH,28 Sep 2022 20:44
APPARTEMENT MEUBLÉE A LOUER (13000DHS/MOIS),Rabat / Agdal,13 000 DH,28 Sep 2022 15:05
UN GRANDE APPARTEMENT A LOUER,Rabat,12 000 DH,28 Sep 2022 11:07
JOLI APPARTEMENT DE 3P A LOUER,Rabat / Agdal,8 000 DH,28 Sep 2022 11:07
APPARTEMENT AU CENTRE DE RABAT AGDAL,Rabat / Agdal,6 000 DH,28 Sep 2022 11:06
Bel appartement Avenue Annakhil,Rabat / Hay Ryad,14 000 DH,27 Sep 2022 16:43
AGDAL APPARTEMENT 4 PIÈCES MEUBLÉ A LOUER,Rabat,8 000 DH,27 Sep 2022 13:21
APPARTEMENT MEUBLEE A 9500 Dhs/mois,Rabat / Harhoura,9 500 DH,27 Sep 2022 13:20
Appartement de 2P a louer,Rabat,3 800 DH,27 Sep 2022 13:20
BEL APPARTEMENT VUE SUR MER A LOUER,Rabat / Ocean,6 000 DH,25 Sep 2022 21:24
Location meublée/Non Meublée à Agdal - Rabat,Rabat / Agdal,4 500 DH,25 Sep 2022 11:54
DES APPARTEMENTS MEUBLES A LOUER,Rabat,6 000 DH,24 Sep 2022 20:31
Location appartement meuble,Rabat / Agdal,11 000 DH,24 Sep 2022 20:31
APPARTEMENT MEUBLE A LA HAUT AGDAL,Rabat / Agdal,8 000 DH,24 Sep 2022 20:31
Appartement de 4 pièces sur agdal,Rabat / Agdal,8 000 DH,23 Sep 2022 19:56
Appartement à louer,Rabat / Centre ville,5 500 DH,23 Sep 2022 19:41
BEL APPARTEMENT A LOUER SUR HAY RIAD,Rabat / Hay Ryad,14 000 DH,23 Sep 2022 19:41
شقة,Rabat / Temara,1 300 DH,21 Sep 2022 17:42
JOLI APPARTEMENT A LOUER (RABAT AGDAL),Rabat / Agdal,8 500 DH,21 Sep 2022 11:51
Location un appartement meublé sur Agdal,Rabat / Agdal,12 000 DH,21 Sep 2022 11:51
APPT 2P HT STANDING,Rabat / Hassan,4 200 DH,20 Sep 2022 14:56
APPARTEMENT A LE HAUT AGDAL,Rabat / Agdal,7 000 DH,20 Sep 2022 10:40
GRAND APPARTEMENT VIDE à LOUER,Rabat,8 500 DH,20 Sep 2022 10:40
APPARTEMENT FAIT DE 110M² EN LOCATION,Rabat,3 800 DH,20 Sep 2022 10:39
APPARTEMENT 4PC PROCHE DU MALL AGDAL,Rabat,6 500 DH,20 Sep 2022 10:39
PROCHE DE RABAT CENTRE APPART 4P EN LOCATION VIDE,Rabat,6 800 DH,19 Sep 2022 13:21
LOCATION D'UN APPARTEMENT DE 3P SUR AGDAL,Rabat / Agdal,6 500 DH,17 Sep 2022 16:17
Trés bel appartement à saisir,Rabat / Hay Ryad,12 500 DH,17 Sep 2022 16:15
Appartement meublée au centre de Rabat,Rabat / Hassan,8 000 DH,16 Sep 2022 21:01
Appartement a hassan,Rabat / Hassan,8 000 DH,16 Sep 2022 21:01
Location triplex  meublé à Harhoura, Temara,Rabat / Agdal,12 000 DH,16 Sep 2022 19:40
Appartement meublé à  Hay Riad Rabat,Rabat / Agdal,18 000 DH,16 Sep 2022 19:40
LE HAUT AGDAL APPARTEMENT A LOUER,Rabat / Agdal,8 000 DH,15 Sep 2022 13:33
PAS LOIN DE LYCÉE DESCARTES DANS UN IMMEUBLE PROPR,Rabat,8 500 DH,15 Sep 2022 13:33
APPARTEMENT A RABAT AGDAL,Rabat / Agdal,4 800 DH,15 Sep 2022 13:33
Appt meublé,Rabat / Agdal,7 000 DH,15 Sep 2022 11:05
APPATEMENT A LOUER,Rabat / Agdal,111 111 DH,14 Sep 2022 11:24
Appartement centre ville rabat,Rabat / Agdal,3 800 DH,14 Sep 2022 05:42
Appartement 4 pièces,Rabat / Agdal,4 500 DH,14 Sep 2022 05:42
APPATEMENT A LOUER,Rabat / Agdal,6 000 DH,13 Sep 2022 16:06
APPT HT STANDING EN LOCATION,Rabat / Hassan,4 200 DH,13 Sep 2022 13:24
Appartement a louer  PRESTIGIA RIAD RABAT,Rabat / Hay Ryad,11 000 DH,12 Sep 2022 23:36
Superbe appart meublé à louer Wifak Temara,Rabat,4 800 DH,12 Sep 2022 19:23
Appartement meublé à louer à l'Agdal,Rabat / Agdal,15 000 DH,12 Sep 2022 19:23
APPARTEMENT EN LOCATION A QBIBAT,Rabat,3 500 DH,12 Sep 2022 16:37
Appartement hay ryad expose,Rabat / Agdal,6 500 DH,12 Sep 2022 10:44
Appartement prestigieux ryad7000dh,Rabat / Hay Ryad,7 000 DH,12 Sep 2022 10:38
Appartementsitué ocean,Rabat / Agdal,3 300 DH,12 Sep 2022 10:38
Appartement 3pieces,Rabat / Agdal,4 000 DH,10 Sep 2022 19:44
COQUET APPARTEMENT MEUBLÉ A RABAT,Rabat,6 500 DH,09 Sep 2022 17:20
Appartement centre agdal4200dh,Rabat / Agdal,4 200 DH,08 Sep 2022 16:48
Appartement hay ryad,Rabat / Hay Ryad,4 800 DH,07 Sep 2022 13:16
Location appartement,Rabat / Akkari,3 200 DH,06 Sep 2022 16:57
Bel appartement agdal 3pieces,Rabat / Agdal,6 300 DH,06 Sep 2022 16:56
Location appartement,Rabat / Akkari,3 200 DH,05 Sep 2022 22:04
Appartement d'une maison,Rabat / Akkari,3 200 DH,05 Sep 2022 22:03
Appartement location,Rabat / Akkari,3 200 DH,05 Sep 2022 22:03
APPARTEMENT FAIT 135M² SUR AGDAL A LOUER,Rabat / Agdal,7 000 DH,05 Sep 2022 13:04
Grande appartement a louer,Rabat / Agdal,8 000 DH,05 Sep 2022 10:55
APPARTEMENT DE LUX A LOUER SUR HAY RIAD,Rabat / Hay Ryad,14 000 DH,05 Sep 2022 10:54
APPARTEMENT EN LOCATION SUR AVIATION MABELLA,Rabat / Mabella,6 500 DH,05 Sep 2022 10:54
Appartement à loué,Rabat,3 500 DH,05 Sep 2022 10:22
Appartement situé rabat,Rabat / Agdal,4 000 DH,04 Sep 2022 06:16
Apparemment avenue hassan2,Rabat / Agdal,4 000 DH,04 Sep 2022 06:15
Duplex meublé avec piscine à louer à Harhoura,Rabat / Harhoura,8 000 DH,04 Sep 2022 06:15
Appartement à louer à lot habitable slimane,Rabat / Yacoub El Mansour,4 500 DH,02 Sep 2022 22:29
Appartement meublée a louer haut agdal,Rabat,10 000 DH,31 Aoû 2022 19:35
APPARTEMENT DE 5P MEUBLE A LOUER,Rabat,12 000 DH,31 Aoû 2022 14:36
LOCATION UN APPARTEMENT DE 4P,Rabat,7 500 DH,31 Aoû 2022 14:36
Appartement vide en location,Rabat,4 000 DH,31 Aoû 2022 14:35
Appartement de 3 pièces en location,Rabat,4 000 DH,31 Aoû 2022 11:26
APPARTEMENT EN LOCATION A SALA JADIDA,Rabat / Sala Jadida,4 500 DH,30 Aoû 2022 16:34
APPARTEMENT A LOCATION 6000 DHS,Rabat,6 000 DH,30 Aoû 2022 16:34
APPARTEMENT AU CENTRE DE RABAT A LOUER,Rabat,6 500 DH,30 Aoû 2022 09:35
LE HAUT AGDAL APPARTEMENT VIDE A LOUER,Rabat / Agdal,8 000 DH,30 Aoû 2022 09:35
APPARTEMENT VIDE EN LOCATION SUR AGDAL,Rabat / Agdal,7 800 DH,30 Aoû 2022 09:35
UN APPARTEMENT EN LOCATION SUR MABELLA,Rabat / Agdal,6 500 DH,30 Aoû 2022 09:35
HAY RIAD UN APPARTEMENT DE LUX A LOUER,Rabat / Hay Ryad,14 000 DH,29 Aoû 2022 19:28
Magnifique Appartement Meublée à louer,Rabat / Agdal,16 000 DH,29 Aoû 2022 17:46
Appartement 4 pièces en location,Rabat / Agdal,8 000 DH,29 Aoû 2022 16:33
Bel appartement meublé à 8500dhs,Rabat / Agdal,8 500 DH,29 Aoû 2022 15:07
Appartement Résidence Clos des Pins,Rabat / Agdal,9 000 DH,29 Aoû 2022 10:45
Location Duplex haut standing à Hay Riad,Rabat / Hay Ryad,14 800 DH,28 Aoû 2022 05:35
Location Duplex haut standing à Hay Riad,Rabat / Hay Ryad,14 800 DH,28 Aoû 2022 05:35
Appartement ensoleillé avec jardin à Hay Riad,Rabat / Hay Ryad,11 500 DH,27 Aoû 2022 04:24
Appartement de standing avec terrasse à Hay Riad,Rabat / Hay Ryad,14 000 DH,27 Aoû 2022 04:23
Appartement près du Lycée Descartes,Rabat / Agdal,9 000 DH,27 Aoû 2022 04:21
Appartement de standing avec terrasse à Hay Riad,Rabat / Hay Ryad,14 000 DH,27 Aoû 2022 04:20
Appartement situe agdal 95m,Rabat / Agdal,6 500 DH,26 Aoû 2022 00:18
Appartement meublé (2 chambres),Rabat / Harhoura,7 500 DH,25 Aoû 2022 19:36
Appartement spacieux à louer à l'Agdal,Rabat / Agdal,9 000 DH,25 Aoû 2022 19:22
Appartement ht standing 2p,Rabat / Hassan,4 300 DH,25 Aoû 2022 15:20
Appartement 3p en location,Rabat / Centre ville,4 200 DH,25 Aoû 2022 15:20
Appartement meublé avec terrasse à Bassatine Al Ma,Rabat,10 000 DH,25 Aoû 2022 14:14
Appartementà louer sur haut agdal,Rabat / Agdal,6 500 DH,25 Aoû 2022 13:11
Appartement meublé  à Bassati Al Manzeh,Rabat,10 000 DH,25 Aoû 2022 13:10
APPARTEMENT PROCHE A LA GARE D'AGDAL,Rabat / Agdal,8 500 DH,25 Aoû 2022 10:54
LOCATION VIDE D'UN APPARTEMENT,Rabat / Agdal,4 000 DH,25 Aoû 2022 10:54
APPARTEMENT 3PIÈCE A LOUER,Rabat / Agdal,7 800 DH,25 Aoû 2022 10:54
Appt bien situé..gare Agdal,Rabat / Agdal,4 500 DH,25 Aoû 2022 10:01
Appartement hay nahda,Rabat / Hay Ennahda,4 600 DH,25 Aoû 2022 10:01
Appartement en location à hay riyad,Rabat / Hay Ryad,18 000 DH,24 Aoû 2022 22:50
Appartement meublé/ agdal,Rabat / Agdal,16 000 DH,24 Aoû 2022 22:50
Appartement meublé à louer  à Agdal RABAT,Rabat / Agdal,10 000 DH,24 Aoû 2022 22:50
Appartement à harhoura,Rabat / Harhoura,6 000 DH,24 Aoû 2022 22:49
Coquette appartement refaite à neuf à Hassan,Rabat / Hassan,7 500 DH,24 Aoû 2022 22:49
APPARTEMENT MEUBLE A LOUER A RABAT,Rabat,7 500 DH,24 Aoû 2022 15:05
